{
  "$schema": "foresight/archetype-design/v2",
  "_readme": {
    "what_this_is": "Instrumented design checkpoints for the ecommerce archetype. Each checkpoint decomposes an allegedly-aesthetic quality into weighted, measurable sub-signals with an explicit scoring formula. The score is COMPUTED from signals, not asserted. Two graders measuring the same signals get the same number - that reproducibility is what makes it an instrument, not an opinion.",
    "why_this_matters": "A UI skin over an LLM says 'this looks good (trust me)'. An instrument says 'this scores 7.4: hierarchy 8, contrast 9, spacing 6, here are the measurements'. Showing the work is the difference.",
    "phase_and_status": "This is the INSTRUMENTED design layer. Its computed/boolean signals correspond to build-order Phase 3 (honest, measurable signals shippable now). Its measurement_type:model_scored signals (saliency_peak, visual_complexity) are build-order Phase 6 EXPERIMENTS - designed here so the formula has a slot for them, but NOT trusted until calibration proves they correlate with reality. Until then they are excluded from the composite per scoring_model.signal_availability_and_renormalization. Treat every number here as unvalidated until the calibration loop (foresight.calibration-1.md) has earned it.",
    "relationship_to_base_archetype": {
      "shared_ids_supersede": "ec.design.visual_hierarchy and ec.design.trust_signals ALSO appear in archetype.ecommerce.json as reasoning-only / taste_limited checkpoints. When this instrumented layer is active, its definition is authoritative for those ids; the base definition is the fallback when the instrument cannot run. The id is UNCHANGED on purpose - per foresight.calibration-1.md a checkpoint id is a stable, permanent contract, so calibration history carries across to the richer definition. This is an archetype version bump, never a rename.",
      "aesthetic_coherence_vs_base": "ec.design.aesthetic_coherence is NEW here and overlaps in spirit with the base archetype's ec.design.system_consistency and ec.design.spacing_system. They are NOT duplicates and must not be double-counted: the base checkpoints are STATIC/definitional (are tokens DEFINED and reused - measured from source), while aesthetic_coherence is COMPUTED FROM THE RENDER (what actually reached the screen - palette discipline, spacing quantization, alignment on real pixels). Definition vs realization: two altitudes of one concern. A roll-up that includes both should read the base checkpoints as 'is there a system' and aesthetic_coherence as 'did the system survive to the rendered page', not as two independent verdicts on the same property."
    },
    "scoring_model": {
      "method": "Each checkpoint = weighted sum of sub-signals, each sub-signal scored 0-10 by a stated measurement. checkpoint_score = round(sum(signal_score * weight), 1). Weights sum to 1.0 per checkpoint.",
      "measurement_types": {
        "computed": "Deterministic from DOM/CSS/render. Same answer every run. (e.g. contrast ratio, element count, size ratio).",
        "model_scored": "A vision/saliency model produces a number from a defined procedure. Reproducible within model variance; report the procedure so it's auditable.",
        "boolean": "Presence/absence, scored 0 or 10.",
        "residual": "The NAMED part that no current proxy captures. Reported separately, never silently folded into the number."
      },
      "honesty_rule": "Every checkpoint reports: composite score, the per-signal breakdown, and an explicit residual_risk note describing what the proxies could miss. The number never hides its basis.",
      "signal_availability_and_renormalization": "The weights below sum to 1.0 ASSUMING every signal can be measured. When a signal cannot be evaluated on a run, the composite is computed over the signals that CAN be measured, with their weights re-normalized to sum to 1.0, and the dropped signals are named explicitly in the breakdown. Two cases trigger this: (1) measurement_type:model_scored signals are DEFERRED experiments (build-order Phase 6), EXCLUDED from the trusted composite until calibration validates them - until then they are reported separately as unweighted experimental readings, never silently folded in; (2) a runtime/computed signal whose view could not be rendered or measured. A composite computed over a reduced signal set MUST report which signals were dropped and the residual that creates - a re-normalized number is still honest only if it says what it left out.",
      "score_scale_mapping": "The base archetype (archetype.ecommerce.json) scores on discrete levels 3/6/9 and states goal_definition (shippable/great) in those terms. To roll a 0-10 instrumented composite into that world, snap to the nearest anchor: composite < 4 -> level 3 (crude/risky); 4 to < 7 -> level 6 (solid/shippable); >= 7 -> level 9 (great). ALWAYS carry the raw 0-10 composite + breakdown alongside the snapped level - the level is only for goal roll-up; the composite and its gap are the truth (same 'trust the gap, not the number' rule as the base archetype). Ceiling caveat: per the base archetype's honest_ceiling, a composite >= 7 on a taste_limited checkpoint means 'level 7-ish mechanically' - claiming a genuine level 9 there still needs human design review the instrument cannot replace."
    }
  },

  "archetype": "ecommerce",
  "dimension": "design",
  "version": "2.1.0",

  "checkpoints": [
    {
      "id": "ec.design.visual_hierarchy",
      "domain": "design", "severity": "high",
      "title": "Visual hierarchy guides the eye (instrumented)",
      "claim_being_quantified": "The eye lands on the right thing first, effortlessly.",
      "signals": [
        {
          "id": "cta_dominance",
          "weight": 0.30,
          "measurement_type": "computed",
          "what": "Visual weight of the intended primary CTA vs all other interactive/heading elements in the same viewport. Visual weight = normalized(area) * contrast_against_bg * color_saliency.",
          "scoring": "Rank all candidate elements by visual weight. 10 if primary CTA is rank 1 by a margin >= 1.5x the rank-2 element; 6 if rank 1 by any margin; 3 if rank 2-3; 0 if not in top 3.",
          "residual_risk": "A CTA can dominate by weight yet sit in a dead zone; pair with saliency_peak below to cover placement."
        },
        {
          "id": "saliency_peak",
          "weight": 0.30,
          "measurement_type": "model_scored",
          "what": "Run the rendered view through a visual-saliency model (predicts where human attention goes). Procedure: capture viewport at 1280px and 360px, generate saliency heatmap, locate the peak attention region.",
          "scoring": "10 if the saliency peak overlaps the intended primary action's bounding box; 6 if within one element-width; 3 if same half of the viewport; 0 otherwise.",
          "residual_risk": "Saliency models are trained on general imagery; domain-specific scanning (e.g. price-first shoppers) may diverge. Report model + version used."
        },
        {
          "id": "type_tier_ratio",
          "weight": 0.20,
          "measurement_type": "computed",
          "what": "Computed font-size ratios between heading tiers (h1->h2->body).",
          "scoring": "10 if a consistent modular ratio in 1.2-1.5 holds across tiers; 6 if tiers are distinct but inconsistent; 3 if two tiers collide in size; 0 if effectively one size.",
          "residual_risk": "Ratio can be correct while weight/color flatten the perceived hierarchy; cta_dominance partly covers this."
        },
        {
          "id": "competing_elements",
          "weight": 0.20,
          "measurement_type": "computed",
          "what": "Count of elements above the fold whose visual weight is within 20% of the primary CTA's (i.e. competing for first attention).",
          "scoring": "10 if 0 competitors; 6 if 1; 3 if 2; 0 if 3+.",
          "residual_risk": "Intentional dual-CTA designs (e.g. 'buy' vs 'add to cart') may legitimately compete; flag for human confirm if count is 1 by design."
        }
      ],
      "residual_risk_overall": "Composite estimates first-glance hierarchy well; it does NOT capture multi-step scan flow or emotional emphasis. If composite >= 8 but the page still feels off, the miss is likely in reading-order across sections - a measurable v2.1 signal (DOM-order vs visual-order correlation) not yet implemented."
    },
    {
      "id": "ec.design.trust_signals",
      "domain": "design", "severity": "high",
      "title": "Checkout earns trust (instrumented)",
      "claim_being_quantified": "The flow feels as safe to enter a card into as a major retailer.",
      "signals": [
        {
          "id": "cost_transparency_timing",
          "weight": 0.35,
          "measurement_type": "computed",
          "what": "Step (or scroll-depth) index at which the full cost breakdown (item + shipping + tax + fees) first becomes visible, relative to the payment-entry step.",
          "scoring": "10 if full costs visible >= 1 step before payment entry; 6 if visible on the payment step itself; 3 if partial (some fee hidden until later); 0 if any fee appears only at/after final confirm.",
          "residual_risk": "Timing can be correct while the breakdown is visually buried; combine with the saliency approach if disputes arise."
        },
        {
          "id": "surprise_cost",
          "weight": 0.25,
          "measurement_type": "boolean",
          "what": "Does ANY mandatory cost (fee, shipping, tax) first appear only at the final confirmation step?",
          "scoring": "0 if yes (a single surprise cost is a known trust-killer and conversion-killer); 10 if no.",
          "residual_risk": "None significant; this is close to a pure signal."
        },
        {
          "id": "designed_states",
          "weight": 0.20,
          "measurement_type": "computed",